{
  "migratedCase": {
    "caseDetails": {
      "originatingOrganisation": "G94DV00",
      "initiationCode": "O",
      "prosecutorCaseReference": "TVL55117DFXXV",
      "dateReceived": "2024-01-15",
      "prosecutor": {
        "prosecutingAuthority": "GAEAA01"
      },
      "sendingCourt": "C50EX00",
      "receivingCourt": "B01LY00",
      "dateOfSending": "2024-08-23",
      "dateOfCommittal": "2024-01-15",
      "receiptType": "Either way case",
      "retrialIndicator": false
    },
    "hearings": [
      {
        "courtHearingLocation": "B01LY01",
        "dateOfHearing": "2024-11-10",
        "timeOfHearing": "10:05:01",
        "durationMinutes": 60,
        "courtRoomId": 60,
        "hearingType": "Trial",
        "listedDefendants": [
          {
            "prosecutorDefendantId": "LIBRA-defendant-id-1",
            "listedOffences": [
              "LIBRA-offence-id-1"
            ]
          },
          {
            "prosecutorDefendantId": "LIBRA-defendant-id-2",
            "listedOffences": [
              "LIBRA-offence-id-2"
            ]
          }
        ]
      }
    ],
    "defendants": [
      {
        "prosecutorDefendantId": "LIBRA-defendant-id-1",
        "documentationLanguage": "W",
        "hearingLanguage": "W",
        "individual": {
          "personalInformation": {
            "title": "Baron",
            "forename": "John",
            "surname": "Smith",
            "contactDetails": {}
          },
          "selfDefinedInformation": {
            "ethnicity": "W1",
            "gender": 1
          }
        },
        "offences": [
          {
            "prosecutorOffenceId": "LIBRA-offence-id-1",
            "offenceCode": "CA03013",
            "offenceSequenceNumber": 1,
            "offenceCommittedDate": "2018-09-10",
            "offenceDateCode": 1,
            "offenceLocation": "Croydon",
            "offenceWording": "TV Licence not paid",
            "chargeDate": "2015-04-04"
          }
        ]
      },
      {
        "prosecutorDefendantId": "LIBRA-defendant-id-2",
        "documentationLanguage": "W",
        "hearingLanguage": "W",
        "individual": {
          "personalInformation": {
            "title": "Baron",
            "forename": "John",
            "surname": "Smith",
            "address": {
              "address1": "armagaddon house",
              "postcode": "M60 1NW"
            },
            "contactDetails": {}
          },
          "selfDefinedInformation": {
            "ethnicity": "W1",
            "gender": 2
          }
        },
        "offences": [
          {
            "prosecutorOffenceId": "LIBRA-offence-id-2",
            "offenceCode": "DA03014",
            "offenceSequenceNumber": 1,
            "offenceCommittedDate": "2018-09-10",
            "offenceDateCode": 1,
            "offenceLocation": "Croydon",
            "offenceWording": "TV Licence not paid",
            "chargeDate": "2015-04-04"
          }
        ]
      }
    ],
    "migrationSourceSystem": {
      "migrationSourceSystemName": "LIBRA",
      "migrationSourceSystemCaseIdentifier": "This is from Libra"
    }
  },
  "materials": [
    {
      "id": "550e8400-e29b-41d4-a716-446655440001",
      "azureLocation": "http://inazure/secrets/1",
      "fileName": "Audio Recording one",
      "fileType": ".wav",
      "documentType": 3
    },
    {
      "id": "550e8400-e29b-41d4-a716-446655440000",
      "azureLocation": "http://inazure/secrets/2",
      "fileName": "Audio Recording two",
      "fileType": ".wav",
      "documentType": 3
    }
  ],
  "metadata": {
    "id": "550e8400-e29b-41d4-a716-446655440003",
    "numberOfMaterials": 2
  },
  "submissionId": "SUBMISSION_ID",
  "azureLocation": "TVL55117DFXXV"
}
