{
  "migratedCase": {
    "caseDetails": {
      "originatingOrganisation": "G94DV00",
      "initiationCode": "O",
      "prosecutorCaseReference": "TVL55117DFXXV",
      "dateReceived": "2024-01-15",
      "prosecutor": {
        "prosecutingAuthority": "GAEAA01"
      },
      "sendingCourt": "C50EX00",
      "receivingCourt": "B01LY00",
      "dateOfSending": "2024-08-23",
      "dateOfCommittal": "2024-01-15",
      "receiptType": "Either way case",
      "retrialIndicator": false,
      "caseMarkers": [
        {
          "markerTypeCode": "CD"
        },
        {
          "markerTypeCode": "YO"
        }
      ]
    },
    "hearings": [
      {
        "courtHearingLocation": "B01LY01",
        "dateOfHearing": "2024-11-10",
        "timeOfHearing": "10:05:01",
        "durationMinutes": 60,
        "courtRoomId": 60,
        "hearingType": "Trial",
        "listedDefendants": [
          {
            "prosecutorDefendantId": "def-ref-0001",
            "listedOffences": [
              "off-ref-0001"
            ]
          },
          {
            "prosecutorDefendantId": "def-ref-0002",
            "listedOffences": [
              "off-ref-0002"
            ]
          }
        ]
      }
    ],
    "defendants": [
      {
        "id": "aaaaaaaa-0000-0000-0000-000000000001",
        "prosecutorDefendantId": "def-ref-0001",
        "documentationLanguage": "W",
        "hearingLanguage": "W",
        "individual": {
          "personalInformation": {
            "title": "Baron",
            "forename": "John",
            "surname": "Smith",
            "address": {
              "address1": "armagaddon house",
              "postcode": "M60 1NW"
            },
            "contactDetails": {}
          },
          "selfDefinedInformation": {
            "ethnicity": "W1",
            "gender": 1
          }
        },
        "offences": [
          {
            "prosecutorOffenceId": "off-ref-0001",
            "offenceCode": "CA03013",
            "offenceSequenceNumber": 1,
            "offenceCommittedDate": "2018-09-10",
            "offenceDateCode": 1,
            "offenceLocation": "Croydon",
            "offenceWording": "TV Licence not paid",
            "chargeDate": "2015-04-04"
          }
        ]
      },
      {
        "id": "aaaaaaaa-0000-0000-0000-000000000002",
        "prosecutorDefendantId": "def-ref-0002",
        "documentationLanguage": "W",
        "hearingLanguage": "W",
        "individual": {
          "personalInformation": {
            "title": "Baron",
            "forename": "John",
            "surname": "Smith",
            "address": {
              "address1": "armagaddon house",
              "postcode": "M60 1NW"
            },
            "contactDetails": {}
          },
          "selfDefinedInformation": {
            "ethnicity": "W1",
            "gender": 2
          }
        },
        "offences": [
          {
            "prosecutorOffenceId": "off-ref-0002",
            "offenceCode": "DA03014",
            "offenceSequenceNumber": 1,
            "offenceCommittedDate": "2018-09-10",
            "offenceDateCode": 1,
            "offenceLocation": "Croydon",
            "offenceWording": "TV Licence not paid",
            "chargeDate": "2015-04-04"
          }
        ]
      }
    ],
    "migrationSourceSystem": {
      "migrationSourceSystemName": "{{SOURCE_SYSTEM}}",
      "migrationSourceSystemCaseIdentifier": "case-identifier-0001"
    }
  },
  "materials": [
    {
      "id": "550e8400-e29b-41d4-a716-446655440001",
      "azureLocation": "{{SOURCE_SYSTEM}}/20082025/case-identifier-0001/11111111-2222-3333-4444-555555555555/recording-one.wav",
      "fileName": "Audio Recording one",
      "fileType": ".wav",
      "documentType": 3
    },
    {
      "id": "550e8400-e29b-41d4-a716-446655440000",
      "azureLocation": "{{SOURCE_SYSTEM}}/20082025/case-identifier-0001/11111111-2222-3333-4444-555555555555/recording-two.wav",
      "fileName": "Audio Recording two",
      "fileType": ".wav",
      "documentType": 3
    }
  ],
  "metadata": {
    "id": "550e8400-e29b-41d4-a716-446655440003",
    "numberOfMaterials": 2
  },
  "submissionId": "11111111-2222-3333-4444-555555555555",
  "azureLocation": "{{SOURCE_SYSTEM}}/20082025/case-identifier-0001/11111111-2222-3333-4444-555555555555"
}
